{
  "$schema": "https://json-schema.org/draft/2020-12/schema",
  "$id": "https://schemas.geotarget.dev/solve-options-v1.schema.json",
  "title": "GeoTarget SolveOptionsV1",
  "type": "object",
  "additionalProperties": false,
  "required": ["schema_version", "wall_time_seconds", "seed", "preset", "answer_level"],
  "properties": {
    "schema_version": {"const": "geotarget.solve-options/v1"},
    "wall_time_seconds": {"type": "number", "exclusiveMinimum": 0},
    "seed": {
      "oneOf": [
        {"type": "integer", "minimum": 0, "maximum": 9007199254740991},
        {"type": "string", "pattern": "^(0|[1-9][0-9]{0,19})$"}
      ]
    },
    "preset": {
      "enum": ["fast", "default", "standard", "thorough"]
    },
    "answer_level": {"enum": ["validated", "exact_if_available"]},
    "worker_count": {"type": "integer", "minimum": 1, "default": 1},
    "checkpoint": {
      "type": "object",
      "additionalProperties": false,
      "required": ["path", "environment_lock"],
      "properties": {
        "path": {"type": "string", "minLength": 1},
        "environment_lock": {"$ref": "#/$defs/environmentLock"}
      }
    }
  },
  "$defs": {
    "sha256": {
      "type": "string",
      "pattern": "^sha256:[0-9a-f]{64}$"
    },
    "pluginId": {
      "type": "string",
      "pattern": "^[0-9a-f]{8}-[0-9a-f]{4}-[0-9a-f]{4}-[0-9a-f]{4}-[0-9a-f]{12}/[A-Za-z_][A-Za-z0-9_.-]*$"
    },
    "semver": {
      "type": "string",
      "pattern": "^(0|[1-9][0-9]*)\\.(0|[1-9][0-9]*)\\.(0|[1-9][0-9]*)(?:-[0-9A-Za-z.-]+)?(?:\\+[0-9A-Za-z.-]+)?$"
    },
    "pluginLock": {
      "type": "object",
      "additionalProperties": false,
      "required": ["plugin_id", "version", "core_abi", "content_hash"],
      "properties": {
        "plugin_id": {"$ref": "#/$defs/pluginId"},
        "version": {"$ref": "#/$defs/semver"},
        "core_abi": {"$ref": "#/$defs/semver"},
        "content_hash": {"$ref": "#/$defs/sha256"}
      }
    },
    "environmentLock": {
      "type": "object",
      "additionalProperties": false,
      "required": ["problem_hash", "plugin_locks", "policy_hash", "environment_hash"],
      "properties": {
        "problem_hash": {"$ref": "#/$defs/sha256"},
        "plugin_locks": {"type": "array", "items": {"$ref": "#/$defs/pluginLock"}},
        "policy_hash": {"$ref": "#/$defs/sha256"},
        "environment_hash": {"$ref": "#/$defs/sha256"}
      }
    }
  }
}
