{
  "schema_version": "geotarget.solve-options/v1",
  "wall_time_seconds": 180,
  "seed": "18446744073709551615",
  "preset": "default",
  "answer_level": "exact_if_available",
  "worker_count": 2,
  "checkpoint": {
    "path": "checkpoint/run-1.json",
    "environment_lock": {
      "problem_hash": "sha256:bbbbbbbbbbbbbbbbbbbbbbbbbbbbbbbbbbbbbbbbbbbbbbbbbbbbbbbbbbbbbbbb",
      "plugin_locks": [
        {
          "plugin_id": "11111111-1111-4111-8111-111111111111/fixture",
          "version": "1.2.3",
          "core_abi": "1.0.0",
          "content_hash": "sha256:aaaaaaaaaaaaaaaaaaaaaaaaaaaaaaaaaaaaaaaaaaaaaaaaaaaaaaaaaaaaaaaa"
        }
      ],
      "policy_hash": "sha256:eeeeeeeeeeeeeeeeeeeeeeeeeeeeeeeeeeeeeeeeeeeeeeeeeeeeeeeeeeeeeeee",
      "environment_hash": "sha256:ffffffffffffffffffffffffffffffffffffffffffffffffffffffffffffffff"
    }
  }
}
